{
  "version": "1.0.0",
  "name": "Intro Scenario",
  "createdAt": "2026-07-12T00:18:43.557Z",
  "turn": 1,
  "phase": 1,
  "dicePolicy": "hybrid",
  "allowVectorMovement": false,
  "map": {
    "mode": "fixed",
    "width": 72,
    "height": 48
  },
  "players": [
    {
      "id": "Player 1",
      "colour": "#e41a1c",
      "vp": 0
    },
    {
      "id": "Player 2",
      "colour": "#377eb8",
      "vp": 0
    }
  ],
  "initialState": {
    "map": {
      "mode": "fixed",
      "width": 72,
      "height": 48
    },
    "players": [
      {
        "id": "Player 1",
        "colour": "#e41a1c",
        "vp": 0
      },
      {
        "id": "Player 2",
        "colour": "#377eb8",
        "vp": 0
      }
    ],
    "objects": []
  },
  "commands": [
    {
      "name": "placeShip",
      "id": "CruiserA1",
      "object": {
        "hull": {
          "points": 26,
          "rows": 4,
          "stealth": "0",
          "streamlining": "none"
        },
        "armour": [
          [
            5,
            0
          ]
        ],
        "systems": [
          {
            "name": "drive",
            "thrust": 4,
            "advanced": false,
            "id": "V3EEn"
          },
          {
            "name": "fireControl",
            "id": "aGa9l"
          },
          {
            "name": "fireControl",
            "id": "qjP-D"
          },
          {
            "name": "screen",
            "area": false,
            "advanced": false,
            "id": "jOZP_"
          },
          {
            "name": "ftl",
            "advanced": false,
            "id": "il46r"
          }
        ],
        "weapons": [
          {
            "name": "pds",
            "id": "qWqFr"
          },
          {
            "name": "pds",
            "id": "jpZ1u"
          },
          {
            "name": "pds",
            "id": "AuYSB"
          },
          {
            "name": "pds",
            "id": "JRsmG"
          },
          {
            "name": "pds",
            "id": "1f4Qj"
          },
          {
            "name": "beam",
            "class": 1,
            "leftArc": "F",
            "numArcs": 6,
            "id": "xBY4j"
          },
          {
            "name": "beam",
            "class": 2,
            "leftArc": "F",
            "numArcs": 6,
            "id": "76XDy"
          },
          {
            "name": "beam",
            "class": 2,
            "leftArc": "F",
            "numArcs": 3,
            "id": "vs5J5"
          },
          {
            "name": "beam",
            "class": 2,
            "leftArc": "AP",
            "numArcs": 3,
            "id": "wN6mZ"
          },
          {
            "name": "beam",
            "class": 3,
            "leftArc": "AP",
            "numArcs": 3,
            "id": "SH5Z2"
          },
          {
            "name": "beam",
            "class": 3,
            "leftArc": "F",
            "numArcs": 3,
            "id": "6484S"
          }
        ],
        "ordnance": [],
        "extras": {},
        "fighters": [],
        "layout": {},
        "orientation": "alpha",
        "points": 300,
        "cpv": 290,
        "name": "A1",
        "mass": 89,
        "class": "Heavy Cruiser"
      },
      "svg": "<symbol viewBox=\"0 0 180 180\"><g transform=\"matrix(1 0 0 .8522 -3.609 7.08)\"><rect width=\"81.504\" height=\"159.167\" x=\"52.985\" y=\"35.07\" rx=\"40.752\" ry=\"11.758\" style=\"fill:#030303;fill-opacity:1;stroke-width:1;stroke-miterlimit:4;stroke-dasharray:none;stroke-dashoffset:0\"/><path d=\"M234.768 115.667c0 20.824-14.014 37.705-31.302 37.705s-31.303-16.881-31.303-37.705c0-20.824 14.015-37.705 31.303-37.705s31.302 16.88 31.302 37.705z\" style=\"fill:#030303;fill-opacity:1;stroke-width:1;stroke-miterlimit:4;stroke-dasharray:none;stroke-dashoffset:0\" transform=\"matrix(1.60189 0 0 2.27335 -232.193 -148.297)\"/></g><g transform=\"matrix(1 0 0 1.9226 1.179 -176.1)\"><rect width=\"113.975\" height=\"23.147\" x=\"33.838\" y=\"141.205\" ry=\"3.156\" style=\"fill:#030303;fill-opacity:1;stroke-width:1;stroke-miterlimit:4;stroke-dasharray:none;stroke-dashoffset:0\"/><g transform=\"translate(0 -.533)\"><g transform=\"translate(-1.665 113.364)\"><path d=\"m506.067 66.378 9.16 15.864 9.158 15.864H487.75l9.159-15.864 9.16-15.864z\" style=\"fill:#030303;fill-opacity:1;stroke-width:1;stroke-miterlimit:4;stroke-dasharray:none;stroke-dashoffset:0\" transform=\"matrix(.58932 0 0 .52947 -274.089 16.654)\"/><rect width=\"34.391\" height=\"46.897\" x=\"6.952\" y=\"17.731\" ry=\"6.395\" style=\"fill:#030303;fill-opacity:1;stroke-width:1;stroke-miterlimit:4;stroke-dasharray:none;stroke-dashoffset:0\"/></g><rect width=\"17.6\" height=\"66.454\" x=\"13.683\" y=\"-160.967\" ry=\"9.062\" style=\"fill:#030303;fill-opacity:1;stroke-width:1;stroke-miterlimit:4;stroke-dasharray:none;stroke-dashoffset:0\" transform=\"scale(1 -1)\"/></g><g transform=\"matrix(-1 0 0 1 177.899 -.533)\"><g transform=\"translate(-1.665 113.364)\"><path d=\"m506.067 66.378 9.16 15.864 9.158 15.864H487.75l9.159-15.864 9.16-15.864z\" style=\"fill:#030303;fill-opacity:1;stroke-width:1;stroke-miterlimit:4;stroke-dasharray:none;stroke-dashoffset:0\" transform=\"matrix(.58932 0 0 .52947 -274.089 16.654)\"/><rect width=\"34.391\" height=\"46.897\" x=\"6.952\" y=\"17.731\" ry=\"6.395\" style=\"fill:#030303;fill-opacity:1;stroke-width:1;stroke-miterlimit:4;stroke-dasharray:none;stroke-dashoffset:0\"/></g><rect width=\"17.6\" height=\"66.454\" x=\"13.683\" y=\"-160.967\" ry=\"9.062\" style=\"fill:#030303;fill-opacity:1;stroke-width:1;stroke-miterlimit:4;stroke-dasharray:none;stroke-dashoffset:0\" transform=\"scale(1 -1)\"/></g></g></symbol>",
      "owner": "Player 1",
      "position": {
        "x": 11.185921371284794,
        "y": 12.196840540965564
      },
      "facing": 3,
      "speed": 0,
      "movementMode": "cinematic"
    },
    {
      "name": "placeShip",
      "id": "CruiserA2",
      "object": {
        "hull": {
          "points": 26,
          "rows": 4,
          "stealth": "0",
          "streamlining": "none"
        },
        "armour": [
          [
            5,
            0
          ]
        ],
        "systems": [
          {
            "name": "drive",
            "thrust": 4,
            "advanced": false,
            "id": "V3EEn"
          },
          {
            "name": "fireControl",
            "id": "aGa9l"
          },
          {
            "name": "fireControl",
            "id": "qjP-D"
          },
          {
            "name": "screen",
            "area": false,
            "advanced": false,
            "id": "jOZP_"
          },
          {
            "name": "ftl",
            "advanced": false,
            "id": "il46r"
          }
        ],
        "weapons": [
          {
            "name": "pds",
            "id": "qWqFr"
          },
          {
            "name": "pds",
            "id": "jpZ1u"
          },
          {
            "name": "pds",
            "id": "AuYSB"
          },
          {
            "name": "pds",
            "id": "JRsmG"
          },
          {
            "name": "pds",
            "id": "1f4Qj"
          },
          {
            "name": "beam",
            "class": 1,
            "leftArc": "F",
            "numArcs": 6,
            "id": "xBY4j"
          },
          {
            "name": "beam",
            "class": 2,
            "leftArc": "F",
            "numArcs": 6,
            "id": "76XDy"
          },
          {
            "name": "beam",
            "class": 2,
            "leftArc": "F",
            "numArcs": 3,
            "id": "vs5J5"
          },
          {
            "name": "beam",
            "class": 2,
            "leftArc": "AP",
            "numArcs": 3,
            "id": "wN6mZ"
          },
          {
            "name": "beam",
            "class": 3,
            "leftArc": "AP",
            "numArcs": 3,
            "id": "SH5Z2"
          },
          {
            "name": "beam",
            "class": 3,
            "leftArc": "F",
            "numArcs": 3,
            "id": "6484S"
          }
        ],
        "ordnance": [],
        "extras": {},
        "fighters": [],
        "layout": {},
        "orientation": "alpha",
        "points": 300,
        "cpv": 290,
        "name": "A2",
        "mass": 89,
        "class": "Heavy Cruiser"
      },